{
  "$schema": "https://json-schema.org/draft/2020-12/schema",
  "title": "Golf Match Input",
  "type": "object",
  "required": [
    "played_at",
    "sides"
  ],
  "properties": {
    "version": {
      "type": "string"
    },
    "import_key": {
      "type": "string"
    },
    "played_at": {
      "type": "string"
    },
    "course": {
      "type": [
        "string",
        "null"
      ]
    },
    "holes": {
      "type": [
        "integer",
        "null"
      ]
    },
    "notes": {
      "type": [
        "string",
        "null"
      ]
    },
    "tag": {
      "type": [
        "string",
        "null"
      ],
      "description": "Compatibilita: singolo tag/competizione. Internamente viene normalizzato in tags."
    },
    "tags": {
      "type": [
        "array",
        "string",
        "null"
      ],
      "description": "Tag o competizioni associati alla partita. Se stringa, puoi separare piu tag con virgole.",
      "items": {
        "type": "string"
      }
    },
    "sides": {
      "type": "array",
      "minItems": 2,
      "description": "Almeno un side deve avere is_winner=true. Se un solo side ha is_winner=true, riceve 3 punti. Se piu side hanno is_winner=true, la partita e un pareggio e ogni side marcato riceve 1 punto.",
      "items": {
        "type": "object",
        "required": [
          "players",
          "is_winner"
        ],
        "properties": {
          "team_name": {
            "type": [
              "string",
              "null"
            ]
          },
          "is_winner": {
            "type": "boolean"
          },
          "players": {
            "type": "array",
            "minItems": 1,
            "items": {
              "type": "string"
            }
          }
        }
      }
    }
  }
}