{
  "version": "golf-match.v1",
  "import_key": "match-msdpo7eg-6w5ijfwn",
  "played_at": "2026-08-03T18:00:00",
  "course": "Golf Sestrieres",
  "holes": 18,
  "notes": null,
  "tags": [
    "Coppa Estate 2026"
  ],
  "sides": [
    {
      "team_name": "Lele-Patrick",
      "is_winner": false,
      "players": [
        "Lele",
        "Patrick"
      ]
    },
    {
      "team_name": "Fra-Riky Tav",
      "is_winner": true,
      "players": [
        "Fra",
        "Riky Tav"
      ]
    }
  ]
}