{
  "version": "golf-match.v1",
  "import_key": "match-mqkz0jwu-izztvb4i",
  "played_at": "2026-06-06T15:32:00",
  "course": "Malaga",
  "holes": 18,
  "notes": null,
  "tags": [],
  "sides": [
    {
      "team_name": "Aloi",
      "is_winner": false,
      "players": [
        "Aloi"
      ]
    },
    {
      "team_name": "Lele",
      "is_winner": true,
      "players": [
        "Lele"
      ]
    },
    {
      "team_name": "Patrick",
      "is_winner": false,
      "players": [
        "Patrick"
      ]
    }
  ]
}
