{
  "version": "golf-match.v1",
  "import_key": "match-ms8yeq7z-k73r9uu3",
  "played_at": "2026-07-31T15:03:00",
  "course": "Golf Sestrieres",
  "holes": 18,
  "notes": null,
  "tags": [
    "Coppa Estate 2026"
  ],
  "sides": [
    {
      "team_name": "Fra",
      "is_winner": false,
      "players": [
        "Fra"
      ]
    },
    {
      "team_name": "Lele",
      "is_winner": true,
      "players": [
        "Lele"
      ]
    }
  ]
}