{
  "version": "golf-match.v1",
  "import_key": "match-ms9fcphh-qhu2v97n",
  "played_at": "2026-07-31T22:57:00",
  "course": "Golf Sestrieres",
  "holes": 9,
  "notes": null,
  "tags": [
    "Coppa Estate 2026"
  ],
  "sides": [
    {
      "team_name": "Alberto",
      "is_winner": false,
      "players": [
        "Alberto"
      ]
    },
    {
      "team_name": "Fra",
      "is_winner": false,
      "players": [
        "Fra"
      ]
    },
    {
      "team_name": "Lele",
      "is_winner": true,
      "players": [
        "Lele"
      ]
    }
  ]
}