{
  "version": "golf-match.v1",
  "import_key": "match-ms8yebhn-kep6i0in",
  "played_at": "2026-07-28T15:03:00",
  "course": "Golf Sestrieres",
  "holes": 18,
  "notes": null,
  "tags": [
    "Coppa Estate 2026"
  ],
  "sides": [
    {
      "team_name": "Ale M",
      "is_winner": false,
      "players": [
        "Ale M"
      ]
    },
    {
      "team_name": "Fra",
      "is_winner": true,
      "players": [
        "Fra"
      ]
    }
  ]
}